"q_num","q_title","q_contents","q_day","q_fav","user_id","q_like","q_lists","q_onoff"
1,질문 있습니다,신림에 괜찮은 치과 있을까요? 과잉진료안하고 가격 괜찮으면 좋겠어요 :),"2021-08-01",145,aaa,65,Q,0
2,순환기내과 다니시는분?,안녕하세요! 화이자 접종 후(2치까지 맞음) 부정맥이 생겼습니다. 순환기내과 괜찮은 곳 추천부탁드려요,"2021-08-01",70,aaa,35,Q,1
3,이쁜 개인카페,서울대입구역 근처 이쁜 개인카페 있으면 정보 부탁드립니다!. 여자들이 좋아할만한 카페 분위기로 부탁드려요,"2021-08-01",40,siddhartha,15,Q,0
4,봉천 중앙할인마트 몇시까지?,서울대입구역 근처 봉천 중앙할인마트 몇 시까지 영업하는지 아시는분?!,"2021-08-01",60,jesus,35,Q,1
5,근처에 서점어디있어요?,서점어디에 있죠?,"2021-08-02",27,jesus,14,Q,0
6,그린피쉬,근처에 그린피쉬가 있는건 아는데 후기들이 너무 나뉘어서 그린시퓌 외 괜찮은 수족관 있을까요?,"2021-08-02",103,siddhartha,45,Q,1
